{
  "$schema": "./schema.json",
  "typeUriPrefix": "https://problems.d2.dcsv.io/",
  "contentType": "application/problem+json",
  "extensionKeys": [
    {
      "constName": "ERROR_CODE",
      "value": "d2_error_code",
      "doc": "The extension key carrying the machine-readable error code (one of the AUTH_* constants from AuthErrorCodes / equivalent)."
    },
    {
      "constName": "MESSAGES",
      "value": "d2_messages",
      "doc": "The extension key carrying the array of TKMessage objects (translation keys + parameter bindings) for client-side rendering."
    },
    {
      "constName": "INPUT_ERRORS",
      "value": "d2_input_errors",
      "doc": "The extension key carrying the array of per-field InputError objects (field name + TKMessage[] errors) for client-side form-level error rendering. Mirrors the inputErrors field on the native D2Result envelope. Emitted only when the source D2Result carries non-empty InputErrors; absent otherwise."
    },
    {
      "constName": "TRACE_ID",
      "value": "traceId",
      "doc": "The extension key carrying the W3C trace id for diagnostic correlation. Unprefixed (W3C-OTel naming alignment) — distinct from the d2_-namespaced D2-private keys."
    },
    {
      "constName": "CORRELATION_ID",
      "value": "correlationId",
      "doc": "The extension key carrying the request correlation id — either the inbound X-Correlation-Id header value (cap-validated against MAX_CORRELATION_ID_LENGTH) or a fresh GUID generated by the customizer when no inbound value was present. Unprefixed (HTTP-convention alignment with the X-Correlation-Id header naming) — distinct from the d2_-namespaced D2-private keys."
    }
  ],
  "titles": [
    {
      "constName": "BAD_REQUEST",
      "httpStatus": 400,
      "value": "Bad Request",
      "doc": "The closed-enum coarse Title for 400 responses."
    },
    {
      "constName": "UNAUTHORIZED",
      "httpStatus": 401,
      "value": "Unauthorized",
      "doc": "The closed-enum coarse Title for 401 responses."
    },
    {
      "constName": "FORBIDDEN",
      "httpStatus": 403,
      "value": "Forbidden",
      "doc": "The closed-enum coarse Title for 403 responses."
    },
    {
      "constName": "NOT_FOUND",
      "httpStatus": 404,
      "value": "Not Found",
      "doc": "The closed-enum coarse Title for 404 responses."
    },
    {
      "constName": "CONFLICT",
      "httpStatus": 409,
      "value": "Conflict",
      "doc": "The closed-enum coarse Title for 409 responses."
    },
    {
      "constName": "PAYLOAD_TOO_LARGE",
      "httpStatus": 413,
      "value": "Payload Too Large",
      "doc": "The closed-enum coarse Title for 413 responses."
    },
    {
      "constName": "TOO_MANY_REQUESTS",
      "httpStatus": 429,
      "value": "Too Many Requests",
      "doc": "The closed-enum coarse Title for 429 responses."
    },
    {
      "constName": "INTERNAL_SERVER_ERROR",
      "httpStatus": 500,
      "value": "Internal Server Error",
      "doc": "The closed-enum coarse Title for 500 responses."
    },
    {
      "constName": "SERVICE_UNAVAILABLE",
      "httpStatus": 503,
      "value": "Service Unavailable",
      "doc": "The closed-enum coarse Title for 503 responses."
    },
    {
      "constName": "REQUEST_FAILED",
      "httpStatus": null,
      "value": "Request Failed",
      "doc": "The fallback Title used when no httpStatus-specific entry matches."
    }
  ]
}
